{
  "$schema": "../../schema/provider.schema.json",
  "schemaVersion": 1,
  "id": "tencent-docs",
  "name": "腾讯文档",
  "vendor": "腾讯",
  "category": "办公协作",
  "summary": "读写腾讯文档、在线表格与智能画布。",
  "description": "腾讯文档官方 MCP 服务：在空间里搜索与新建文档、读写正文、导入导出，也能按 Markdown 生成智能画布。",
  "examples": [
    "在腾讯文档新建一份「Q3 项目周报」，把我给的大纲补成完整正文",
    "搜一下我空间里最近改过的需求文档，列出标题和更新时间",
    "把这份 Markdown 导入腾讯文档，生成可协作的在线文档",
    "把会议纪要整理成一页智能画布，包含时间线和待办"
  ],
  "tags": [
    "文档",
    "在线表格",
    "智能画布"
  ],
  "order": 91,
  "server": {
    "serverName": "tencent-docs",
    "transport": "streamable-http",
    "url": "https://docs.qq.com/openapi/mcp"
  },
  "auth": {
    "type": "oauth2",
    "flow": "pkce",
    "registration": "dcr",
    "scopes": [
      "docs:read",
      "docs:write"
    ],
    "help": {
      "url": "https://docs.qq.com/open/document/mcp/",
      "label": "查看腾讯文档 MCP 说明",
      "hint": "授权后在浏览器登录腾讯文档即可；调用按账号的每日额度计，令牌只保存在本机。"
    }
  },
  "translations": {
    "en": {
      "summary": "Read and write Tencent Docs, online sheets, and smart canvases.",
      "description": "Official Tencent Docs MCP service: search and create documents, read and write body content, import and export, and generate smart canvases from Markdown.",
      "examples": [
        "Create a Q3 project weekly report in Tencent Docs and expand my outline into full text",
        "Find recently updated requirement docs in my space and list titles and update times",
        "Import this Markdown as a collaborative Tencent Doc",
        "Turn the meeting notes into a one-page smart canvas with a timeline and action items"
      ],
      "name": "Tencent Docs",
      "vendor": "Tencent"
    }
  }
}
