{
  "$schema": "../../schema/provider.schema.json",
  "schemaVersion": 1,
  "id": "circleci",
  "name": "CircleCI",
  "vendor": "CircleCI",
  "category": "开发工具",
  "summary": "查询 CircleCI 流水线、工作流与构建结果。",
  "description": "CircleCI 官方 MCP 服务，可查询流水线、工作流、构建状态与失败原因。",
  "examples": [
    "查最近失败的流水线",
    "总结一个工作流的失败步骤",
    "查看项目的最新构建",
    "对比两次构建的耗时"
  ],
  "tags": [
    "CI/CD",
    "流水线",
    "构建"
  ],
  "order": 73,
  "server": {
    "serverName": "circleci",
    "transport": "streamable-http",
    "url": "https://mcp.circleci.com/v1/mcp"
  },
  "auth": {
    "type": "oauth2",
    "flow": "pkce",
    "registration": "dcr",
    "clientName": "DSH 连接器"
  },
  "translations": {
    "en": {
      "summary": "Inspect CircleCI pipelines, workflows, and build results.",
      "description": "Official CircleCI MCP service for pipelines, workflows, build status, and failure reasons.",
      "examples": [
        "Show recently failed pipelines",
        "Summarize the failed steps in a workflow",
        "View the latest build for a project",
        "Compare the duration of two builds"
      ]
    }
  }
}
