{
  "$schema": "../../schema/provider.schema.json",
  "schemaVersion": 1,
  "id": "github",
  "name": "GitHub",
  "vendor": "GitHub",
  "category": "开发工具",
  "summary": "通过 GitHub 官方 MCP 接入，使用 PAT 访问仓库、Issue 与 Pull Request。",
  "description": "GitHub 官方 MCP 服务，支持仓库、Issue、Pull Request、代码搜索等工具。安装时粘贴 GitHub PAT，令牌只保存在本机。",
  "examples": [
    "帮我看看 owner/repo 这个仓库是做什么的，列出主要目录和技术栈",
    "查看 owner/repo 最近的 open PR，按更新时间排序并总结改动",
    "把当前工作区的改动整理成提交说明，并推送到 GitHub",
    "给 owner/repo 的 #123 补充一条评论，说明测试结果"
  ],
  "tags": [
    "代码托管",
    "Issue",
    "Pull Request"
  ],
  "featured": true,
  "order": 10,
  "server": {
    "serverName": "github",
    "transport": "streamable-http",
    "url": "https://api.githubcopilot.com/mcp/"
  },
  "auth": {
    "type": "bearer",
    "label": "GitHub PAT",
    "help": {
      "url": "https://github.com/settings/tokens/new?scopes=repo,read:org,read:user&description=DSH%20Connectors",
      "label": "创建 GitHub PAT",
      "hint": "建议勾选 repo、read:org、read:user；令牌只保存在本机。"
    }
  },
  "translations": {
    "en": {
      "summary": "Connect through the official GitHub MCP and use a PAT for repositories, issues, and pull requests.",
      "description": "Official GitHub MCP service with repository, issue, pull request, and code search tools. Paste a GitHub PAT during installation; the token stays on this machine.",
      "examples": [
        "Explain what owner/repo does and list its main directories and stack",
        "Show recent open PRs in owner/repo, sorted by update time, and summarize changes",
        "Turn the current workspace changes into a commit message and push to GitHub",
        "Add a comment to owner/repo#123 with the test results"
      ]
    }
  }
}
