{
  "$schema": "../../schema/provider.schema.json",
  "schemaVersion": 1,
  "id": "hugging-face",
  "name": "Hugging Face",
  "vendor": "Hugging Face",
  "category": "知识检索",
  "summary": "检索 Hugging Face 模型、数据集与 Spaces。",
  "description": "Hugging Face 官方 MCP 服务，可搜索模型、数据集与 Spaces，适合选型和查找 AI 资源。需要宿主可访问 huggingface.co；使用系统代理时请确保宿主进程继承代理设置。",
  "examples": [
    "找适合中文问答的开源模型",
    "查一个数据集的大小、字段和许可证",
    "对比两个模型的参数规模与许可证",
    "找一个可用的 Spaces 示例"
  ],
  "tags": ["模型", "数据集", "AI"],
  "order": 64,
  "server": {
    "serverName": "hugging-face",
    "transport": "streamable-http",
    "url": "https://huggingface.co/mcp"
  },
  "auth": {
    "type": "bearer",
    "label": "Hugging Face Token",
    "help": {
      "url": "https://huggingface.co/settings/tokens",
      "label": "创建 Hugging Face Token",
      "hint": "建议使用 read 权限；令牌只保存在本机。"
    }
  }
}
