{
  "$schema": "../../schema/provider.schema.json",
  "schemaVersion": 1,
  "id": "linear",
  "name": "Linear",
  "vendor": "Linear",
  "category": "项目管理",
  "summary": "检索和更新 Linear 的 issue、项目与评论。",
  "description": "Linear 官方 MCP 服务，支持 issue、project、cycle、comment 等工具。安装时粘贴 Linear API Key，令牌只保存在本机。",
  "examples": [
    "列出我最近负责的 Linear issue，按优先级排序",
    "在 ENG 团队创建一个 bug issue，说明复现步骤",
    "查看 ENG 当前 cycle 的进展和阻塞项",
    "给 issue ENG-123 添加一条评论，说明修复情况"
  ],
  "tags": [
    "项目管理",
    "Issue",
    "Cycle"
  ],
  "order": 20,
  "server": {
    "serverName": "linear",
    "transport": "streamable-http",
    "url": "https://mcp.linear.app/mcp"
  },
  "auth": {
    "type": "oauth2",
    "flow": "pkce",
    "registration": "dcr",
    "scopes": [
      "read",
      "write"
    ],
    "help": {
      "url": "https://linear.app/docs/mcp",
      "label": "查看 Linear MCP 说明",
      "hint": "在浏览器里登录 Linear 完成授权；令牌只保存在本机。"
    }
  }
}
